{
  "contract": "hwp-pdf-parity-scoreboard-v2",
  "poppler_version": "pdfinfo version 24.02.0",
  "dpi": 150,
  "thresholds": {
    "media_box_pt": 0.5,
    "dx_px": 2,
    "dy_px": 2,
    "ink_ratio_min": 0.97,
    "ink_ratio_max": 1.03,
    "bad_pixel_pct_max": 0.05,
    "mae_max": 5.0,
    "roi_match_radius_px": 10,
    "roi_precision_min": 0.95,
    "roi_recall_min": 0.95
  },
  "eligible": true,
  "passed_gates": [
    "page_count",
    "media_box",
    "text",
    "fonts",
    "render_issues",
    "raster",
    "roi",
    "determinism"
  ],
  "failed_gates": [],
  "excluded_gates": [],
  "blocking_failed_gates": [],
  "cases": [
    {
      "name": "public-rfp-hwp",
      "source_sha256": "4ff3c231d835f37ceaa08ccd41f7db66d74d65a5a03c0791f6f683cc9fde0d39",
      "oracle_sha256": "b663df719837fd3b07d458a7e5aea441d8bcd0895ac90983fe67714067070f9f",
      "passed_gates": [
        "page_count",
        "media_box",
        "text",
        "fonts",
        "render_issues",
        "raster",
        "roi",
        "determinism"
      ],
      "failed_gates": [],
      "excluded_gates": [],
      "blocking_failed_gates": [],
      "eligible": true,
      "pages_delta": 0,
      "media_box_max_delta_pt": 0.2799999999999727,
      "text_pages_equal": 1,
      "text_pages_compared": 1,
      "raster_pages": 1,
      "max_abs_dx": 0,
      "max_abs_dy": 0,
      "ink_ratio_min": 0.9942722916603088,
      "ink_ratio_max": 0.9942722916603088,
      "bad_pixel_pct_max": 0.01794285885989666,
      "mae_max": 2.8790488243103027,
      "roi_count": 4,
      "roi_precision_min": 0.9952672605790646,
      "roi_recall_min": 0.9511543394613082,
      "fonts_passed": true,
      "render_issues_passed": true,
      "deterministic": true
    },
    {
      "name": "public-rfp-hwpx",
      "source_sha256": "9af272aeff59a3e5953c92400458990d511a04e13bea7d9c348591846aebbefd",
      "oracle_sha256": "b663df719837fd3b07d458a7e5aea441d8bcd0895ac90983fe67714067070f9f",
      "passed_gates": [
        "page_count",
        "media_box",
        "text",
        "fonts",
        "render_issues",
        "raster",
        "roi",
        "determinism"
      ],
      "failed_gates": [],
      "excluded_gates": [],
      "blocking_failed_gates": [],
      "eligible": true,
      "pages_delta": 0,
      "media_box_max_delta_pt": 0.2799999999999727,
      "text_pages_equal": 1,
      "text_pages_compared": 1,
      "raster_pages": 1,
      "max_abs_dx": 0,
      "max_abs_dy": 0,
      "ink_ratio_min": 0.9942722916603088,
      "ink_ratio_max": 0.9942722916603088,
      "bad_pixel_pct_max": 0.01794285885989666,
      "mae_max": 2.8790488243103027,
      "roi_count": 4,
      "roi_precision_min": 0.9952672605790646,
      "roi_recall_min": 0.9511543394613082,
      "fonts_passed": true,
      "render_issues_passed": true,
      "deterministic": true
    }
  ]
}
